{
  "schema_version": "product-decision-paf/hypothesis-proposal-intent/v1",
  "data_policy": "safe_refs_and_summaries_only",
  "artifact_kind": "proposal_intent",
  "intent_id": "intent-no-store",
  "request_id": "request-no-store",
  "created_at": "2026-07-26T10:00:00Z",
  "requested_operation": "create",
  "known_bindings": {
    "workspace_id": null,
    "product_ref": null,
    "hypothesis_id": null,
    "decision_scope_id": null,
    "owner_tenure_id": null,
    "expected_workspace_revision": null,
    "candidate_workspace_revision": 0,
    "current_workspace_snapshot_ref": null,
    "matching_accepted_receipt_ref": null,
    "write_authority": false,
    "state_root_or_host_adapter_ref": null
  },
  "requested_change": {
    "summary": "Start a named product hypothesis without inventing missing product, scope, owner, or validation bindings.",
    "requested_hypothesis_label": "H-no-store",
    "hypothesis_statement": null,
    "target_state": "framing",
    "hypothesis_class": null,
    "lifecycle_context": [],
    "segment": null,
    "validation_design_ref": null
  },
  "unresolved_bindings": [
    "workspace_id",
    "product_ref",
    "decision_scope",
    "owner_tenure",
    "hypothesis_id",
    "hypothesis_statement",
    "hypothesis_class",
    "lifecycle_context",
    "segment",
    "validation_design",
    "write_authority",
    "state_root_or_host_adapter"
  ],
  "materialization_contract": {
    "must_resolve_all_bindings": true,
    "full_candidate_state_required": true,
    "exact_change_manifest_required": true,
    "adapter_accepts_this_artifact": false,
    "required_to_commit": [
      "resolved_bindings",
      "schema_valid_change_set",
      "authorized_host_adapter",
      "write_authority",
      "explicit_state_root"
    ],
    "required_for_future_resume": [
      "accepted_workspace_snapshot",
      "matching_accepted_receipt"
    ],
    "next_step": "Resolve the listed bindings, materialize a complete change set, commit it through an authorized adapter, and retain its accepted receipt plus exact readback."
  },
  "commit_eligible": false,
  "persistence_status": "not_persisted",
  "enforcement_boundary": {
    "reasoning": "instruction_supported",
    "persistence": "host_required",
    "external_effect": "not_supported_standalone"
  }
}
